ids,intents,sentences,sentence_orgin
2644,play_music,Chơi bài hát Rihanna mới ,play new rihanna song
2855,weather_query,hôm nay trời mưa ,is it raining today
12518,transport_query,bao lâu để đến đó ,how long does it take to get there
12918,transport_taxi,olly mở ứng dụng uber và xin cho tôi một chiếc xe hơi ,olly open the uber app and get me a car please
4719,weather_query,nhiệt độ sẽ ở trên đóng băng vào thứ Tư ,will the temperature be above freezing on wednesday
5595,takeaway_order,mở Grubhub. ,open grubhub
15683,social_post,Tweet đến BBB mà Burger King quá đắt ,tweet to the bbb that burger king is too expensive
14234,qa_currency,Tỷ lệ giữa các loại tiền tệ này ,rate between these currencies
14551,qa_stock,Vui lòng cho biết giá mở của cổ phiếu FRA ,please indicate the opening price of fra stock
6239,general_quirky,Hôm nay tôi nhận được phần thưởng ,today i got rewards
6066,audio_volume_mute,Đừng nói chuyện ,don't talk
14335,qa_stock,Những gì cổ phiếu của táo ,what's the stock of apple
16331,email_query,Chuyển đổi nội dung email ,transcribe email content
4358,takeaway_order,đặt một số gà rán từ gà của nhà thờ thông qua grubhub ,order some fried chicken from church's chicken via grubhub
479,news_query,Tìm tin tức về bài phát biểu của Trump ,find me news about trumps speech
4777,music_settings,xáo trộn các bài hát trong thư viện âm nhạc ,shuffle the songs in the music library
14176,qa_stock,Giá cổ phiếu cho ,what is the stock price for
15889,email_sendemail,Bạn có thể vui lòng gửi và gửi email cho bạn tôi Susie để cô ấy biết tôi sẽ không ở nhà thờ vào ngày mai ,could you please send and email to my friend susie letting her know i won't be at church tomorrow
4004,iot_hue_lightup,sáng đèn phòng khách ,brighten living room lights
7592,calendar_query,từ bốn đến sáu khi nào tôi có một giờ nghỉ miễn phí ,from four to six when do i have a free break
6809,calendar_set,"Tôi sẽ tham dự đám cưới của Lily vào tuần tới với bạn trai của tôi, vui lòng thêm nó vào lịch của tôi ",i will attend lily's wedding next week with my boyfriend please add it to my calendar
13700,general_quirky,Cuộc sống của bạn đã được tôi thay đổi như thế nào ,how has your life been changed by me
14483,transport_query,"Khi nào là thời điểm tốt nhất để đi du lịch đến Canada, nơi sử dụng sân bay nào ",when is the best time to travel to canada what airport to use
14402,general_quirky,Đặt tôi một cái gì đó trực tuyến ,order me something online
2961,music_settings,lặp lại tất cả ,repeat all
703,iot_hue_lightdim,Tôi muốn đèn sáng hơn sáng hơn ,i want the lights less brighter
16792,email_sendemail,chào gửi tôi yêu bạn nhắn tin cho vợ tôi ,hi send i love you message to my wife
3283,iot_hue_lightdim,Xin vui lòng đèn tối hơn ,darker lights please
2871,alarm_query,Báo động nào đã được đặt cho tôi ,what alarms have been set for me
4499,audio_volume_mute,Đặt cài đặt để tắt tiếng ,set the settings to mute
7803,calendar_set,Làm một lời nhắc nhở lặp lại cho thực hành yoga của tôi mỗi ngày vào buổi trưa ,make a repeating reminder for my yoga practice every day at noon
671,datetime_query,bạn có thể cho tôi biết ngày nào ,can you tell me what date it is
3664,weather_query,bạn có thể cho tôi biết nhiệt độ cho tối thứ bảy ,can you tell me the temperature for saturday night
5008,weather_query,Tôi có cần một chiếc áo khoác vào chiều nay ,do i need a jacket this afternoon
546,play_music,hey olly chơi danh sách phát ,hey olly play the playlist
7001,calendar_set,tạo sự kiện ,create event
10434,lists_remove,Xóa danh sách này ,delete this list
8785,calendar_set,Lịch họp với nhân viên của chúng tôi về tiền thưởng ,schedule meeting with our employees regarding bonus
16548,email_sendemail,Bạn có thể gửi email Mary và để cô ấy biết tôi đang trên đường ,can you email mary and let her know i am on my way
16794,email_query,Vui lòng liệt kê người gửi email nhận được từ ba ngày qua ,please list the senders of received emails from the last three days
16687,email_sendemail,Gửi email địa chỉ mới ,send email new address
367,news_query,những gì đang xảy ra trong tin tức ,what's going on in the news
5276,music_settings,Vui lòng không xáo trộn các bài hát trong trình phát nhạc chỉ cần chơi liên tục ,please don't shuffle songs in music player just playing continuously
6276,general_quirky,Tôi đã đi trượt tuyết ngày hôm nay ,i went skiing today
10822,lists_query,Tên tất cả các danh sách ,name all lists
15737,social_post,Olly Gửi một đánh giá tiêu cực về một công ty ,olly submit a negative review about a company
2014,music_query,Lời bài hát cho bài hát này là gì ,what are the lyrics to this song playing
12391,transport_query,Hiển thị cho tôi bản đồ của vị trí này ,show me map of this location
16732,email_query,Olly tôi có email mới từ ryan không ,olly do i have any new email from ryan
14513,qa_stock,cho tôi giá cổ phiếu mở của công nghệ Infosys ngày nay ,give me the opening stock price of infosys technologies today
1496,music_query,Đề xuất các bài hát dựa trên danh sách phát của tôi ,recommend songs based on my playlist
7343,calendar_remove,Thoát khỏi mọi thứ trên lịch của tôi ,get rid of everything on my calendar
5706,play_music,Bắt đầu danh sách nhạc phim của tôi ,start my movies soundtrack list
4907,general_joke,Mở truyện cười ,open jokes
6086,weather_query,Thời tiết ở mã zip là gì ba mươi hai nghìn hai trăm ba mươi bốn ,what is the weather in zip code thirty two thousand two hundred and thirty four
9836,play_audiobook,âm nhạc hai. ,music two
14028,qa_factoid,George w Bush từ đâu ,where is george w bush from
6328,general_quirky,"Có một phần nhất định trong ngày của tôi, nơi tôi đang mệt mỏi ",there are certain parts of my day where i am fatigued
1062,news_query,Tôi muốn nhận thông báo hàng giờ về tin tức tài chính ,i want to get hourly notification on financial news
14557,qa_factoid,Những bộ phim nào có Clancy Brown đã chơi trong ,what movies has clancy brown played in
7552,news_query,Nói cho tôi biết những gì đã xảy ra hôm nay từ tám giờ sáng đến chín giờ sáng ,tell me what happened today from eight am to nine am
3553,play_music,Tôi muốn nghe danh sách nghiên cứu ,i want to hear study playlist
7586,calendar_set,Thêm sự kiện trong lịch ,add event in calendar
16355,email_query,Chủ đề của email cuối cùng của tôi đến Tom là gì ,what was the subject of my last email to tom
910,datetime_query,Bây giờ là mấy giờ ở New York ,what time is it right now in new york
16498,email_sendemail,Gửi email nhắc nhở ,send a remind email
7597,calendar_set,Vui lòng thiết lập sự kiện cuộc họp thông thường cho các chuyến đi kinh doanh của chúng tôi ,please set up the usual meeting event for our business trips
1555,weather_query,Thời tiết sẽ diễn ra như thế nào trong tuần này ,how's the weather going to be this week
12193,transport_ticket,Đặt vé tàu từ Los Angeles đến Chicago đi qua Miami ,book a train ticket from los angeles to chicago that goes via miami
11290,play_podcasts,podcast tốt nhất là gì ,what's the best podcast
1967,iot_hue_lightchange,Thay đổi màu sáng thành màu vàng ,change light colour to yellow
13535,general_quirky,sẽ có nhiều gỗ có thể một mâm cặp gỗ nếu một chiếc gỗ có thể chục gỗ ,would much wood could a woodchuck chuck if a woodchuck could chuck wood
6804,calendar_set,Nhắc nhở tôi đi ngủ trước một giờ sáng mỗi ngày ,remind me to go to bed before one am everyday
3860,play_music,Chơi tất cả các bài hát Latin yêu thích của tôi ,play all my favorite latin songs
16112,email_query,vâng tôi muốn kiểm tra ,yes i want to check
15066,qa_currency,Tôi có thể nhận được bao nhiêu peso cho một đô la ngay bây giờ ,how many pesos can i get for a dollar right now
3064,alarm_remove,Báo thức này cần phải được im lặng vĩnh viễn ,this alarm needs to be permanently silenced
1795,datetime_query,hôm nay là ngày bao nhiêu ,what is the date today
7887,calendar_query,Những cuộc họp nào tôi đã có tuần trước ,what meetings did i have last week
3477,play_music,Chơi hai mươi lăm lượt truy cập hàng đầu ,play top twenty five hits
16474,email_sendemail,Gửi email đến Stan Francis ,send an email to stan francis
7850,calendar_set,Thông báo cho tôi khi tiền thuê của tôi đến hạn ,notify me when my rent due
14829,qa_factoid,Mt cao bao nhiêu ,how tall is mt everest
7929,calendar_set,Thêm cuốn sách sự kiện Club Debbie Nhà thứ tư tối thứ tư ,add event book club debbie's house wednesday night
4237,weather_query,Thời tiết như thế nào bây giờ ,what's the weather like right now
834,news_query,Hãy cho tôi biết những tin tức mới nhất từ BBC Sports ,tell me the latest news from bbc sports
5879,iot_cleaning,Bắt đầu Irobot. ,start irobot
7708,alarm_set,Vui lòng đặt báo thức cho cuộc họp ngày mai lúc bảy giờ sáng ,please set an alarm for tomorrows meeting at seven am
5135,play_music,Bắt đầu danh sách yêu thích của tôi ,start my favorites playlist
3638,music,được cảnh báo bởi công nghệ ,put on be warned by tech
12637,transport_traffic,Giao thông trông như thế nào trên Cầu Cổng Vàng ,what's traffic look like over the golden gate bridge
6310,alarm_set,Tôi muốn một báo động trong sáu giờ sáng mỗi ngày ,i want an alarm for six am everyday
4679,weather_query,Tôi có cần một chiếc áo khoác nhẹ hoặc nặng nề ngày hôm nay ,do i need a light or heavy jacket today
509,alarm_query,Tôi có báo động nào ,which alarms do i have
16721,email_querycontact,Bills Pager số trong danh bạ của tôi ,is bills pager number in my contacts
14515,qa_factoid,Chi phí của iPhone bảy là bao nhiêu ,what is the cost of iphone seven
16138,email_query,Chỉ cho tôi tất cả các email nhận được gần đây ,show me all the emails received recently
4342,audio_volume_down,Giảm âm lượng của loa ,lower the volume of the speakers
11901,recommendation_locations,cửa hàng địa phương ,local shops
13050,qa_factoid,Bryan Adams được sinh ra khi nào ,when was bryan adams born
4231,play_music,Chơi Heady Head By Passion Pit ,play sleepy head by passion pit
11415,play_podcasts,Chơi phần tiếp theo trong loạt bài này ,play the next part in this series
8628,calendar_set,nhắc nhở tôi hàng ngày lúc năm giờ sáng ,remind me everyday at five am
10777,lists_query,Tôi có một danh sách Amazon được lưu ,do i have an amazon list saved
10473,lists_createoradd,Tôi cần kết hợp một danh sách việc cần làm cho công việc ,i need to put together a todo list for work
8374,alarm_set,Tạo sự kiện với báo thức để gặp nhau trong hai giờ ,create event with alarm for meeting in two hours
16927,email_query,Tôi có email nào trong giờ cuối cùng không ,do i have any emails in the last hour
6604,general_quirky,Nhắc nhở tôi khi một số marvel nhất định hiển thị trở về netflix ,remind me when certain marvel shows return to netflix
14518,qa_definition,cho tôi định nghĩa về từ áo giáp ,give me the definition of the word armor
2401,music_likeness,Bạn có thể lưu cái này là một bài hát hay cho tôi ,can you save this what a nice song for me
1432,audio_volume_up,Vui lòng bật lên âm lượng ,please turn up the volume
12275,transport_query,Sửa tuyến đường lái xe từ đây để cấp thị trường ,fix the driving route from here to grant market
14984,qa_currency,Alexa cho tôi biết tỷ giá hối đoái mười đô la đến Euro ,alexa tell me the exchange rate of ten dollar to euro
4284,iot_hue_lightup,bật lên độ sáng của đèn ,turn up the brightness of the lights
14974,qa_definition,Muốn biết mô tả về một chiếc xe hơi ,would like to know the description of a car
5071,alarm_set,Đặt báo động mới vào năm giờ sáng ,set new alarm on five am
15799,email_query,Hiển thị email mới cho tôi ,show new emails to me
9522,play_radio,Chơi buổi trình diễn chín mươi bảy buổi sáng ngày hôm qua ,play yesterday's hot ninety seven morning show
9654,play_radio,Chơi một bộ phim hay trên tivi của tôi ,play a good movie on my television
6989,calendar_set,Làm ơn nhắc tôi cuộc hẹn với bác sĩ của tôi vào tháng mười mười ba ,please remind me my doctor appointment on thirteenth july
1187,play_music,đặt một dấu vết vũ trường ,put a disco track
7350,calendar_set,Lịch của tôi sẽ được cập nhật với tất cả sự kiện RCCG vào tháng 3 ,my calendar is to be updated with all rccg event in march
84,iot_cleaning,robot sạch hơn trên ,turn cleaner robot on
3955,alarm_set,Đặt báo thức cho chín giờ chiều ,set an alarm for nine pm
687,datetime_query,cho tôi thời gian ở Washington ,give me the time in washington
6536,general_quirky,tên bạn là gì ,what's your name
9911,cooking_recipe,Tôi nên đun sôi trứng trong bao lâu ,how long should i boil the eggs
8950,calendar_remove,Tìm phần còn lại và xóa ,find remainder and delete
4698,alarm_set,nhắc tôi lúc năm giờ chiều ,remind me at five pm
4633,iot_hue_lightoff,Đèn phòng ngủ tắt ngay bây giờ ,bedroom lights off now
5230,weather_query,Tôi có nên đội mũ ngày hôm nay ,should i wear a hat today
15323,social_query,Những gì mới nhất trong phương tiện truyền thông xã hội của tôi ,what's the latest in my social media
16110,email_sendemail,Tất cả các email nhận được từ mười giờ chiều đến bảy giờ sáng mỗi ngày sẽ được trả lời ,all emails received between ten pm and seven am everyday is to be replied
16952,email_querycontact,Email của Charles là gì ,what is charles's email
11661,recommendation_locations,Olly bạn có thể tìm thấy một nhà hàng đẹp trung tâm thành phố ,olly can you find a nice restaurant downtown
6846,calendar_set,nhắc nhở tôi một email cho chị tôi ,remind me an email to my sister
13082,qa_factoid,Đặt cho tôi một chuyến bay đến Mars vào năm tới ,book me a flight to mars next year
4041,play_music,Chơi bốn mươi sáu và hai theo công cụ ,play forty six and two by tool
6977,calendar_query,bạn có thể đọc cho tôi lời nhắc tiếp theo của tôi ,can you read me my next reminders
6336,general_quirky,Bạn sẽ không bao giờ đoán được những gì đã xảy ra vào đầu ngày hôm nay ,you'll never guess what happened earlier today
13940,qa_definition,Từ có nghĩa là gì ,what does word mean
10036,cooking_recipe,Cách nấu cơm vàng ,how to cook yellow rice
722,alarm_set,làm cho một báo động để đánh thức tôi dậy sau năm giờ ,make an alarm to wake me up after five hours
2280,play_music,Chơi nhạc được thêm gần đây ,play recently added music
12196,transport_traffic,Mức độ giao thông ở Washington là gì ,what is level of traffic at washington
16507,email_sendemail,Gửi email đến địa chỉ email mới ,send email to new email address
2939,play_music,Alexa chơi danh sách phát gần đây nhất của tôi ,alexa play my most recent playlist
5739,iot_hue_lightchange,Bạn có thể thay đổi màu đèn thành màu xanh lá cây xin vui lòng ,could you change the lights colour to green please
5817,weather_query,Thời tiết thị trấn quê hương ,home town weather
12203,transport_query,đưa con đường ngắn nhất đến sân bay ,give the shortest route to the airport
14079,qa_factoid,tam giác bermuda ở đâu ,where is burmuda triangle
4510,datetime_query,ngay hiện tại ,current date
14878,qa_definition,nghĩa là ,mean
6427,general_quirky,Tennis. ,tennis
12683,transport_query,Các chuyến tàu khởi hành vào thời gian nào Atlanta ,what time do the trains depart to atlanta
4366,general_joke,bất kỳ trò đùa hài hước ,any funny jokes
1329,weather_query,Thời tiết hôm nay là bình thường ,is weather normal today
12038,recommendation_locations,Hỏi một trung tâm mua sắm trong khu vực tôi ,ask a shopping malls in me area
9861,play_audiobook,Tiếp tục chơi nơi tôi rời khỏi cuốn sách trên Audible ,resume play where i left off in book on audible
16246,email_sendemail,Gửi email đến Joanne @ AOL DOT COM và thêm làm liên hệ mới ,send email to joanne@aol dot com and add as new contact
3189,news_query,Chiến tranh ở Syria đã kết thúc ,has the war in syria ended
1488,play_music,Chơi Jazz từ album mới nhất của Jennifer ,play jazz from jennifer's latest album
5928,iot_coffee,Vui lòng bật máy pha cà phê và bắt đầu chu kỳ pha ,please turn on coffee maker and start brew cycle
2900,takeaway_order,Nhận pizza lớn với pepperoni ,get large pizza with pepperoni
1403,play_music,Hai mươi hit jazz hàng đầu là gì ,what are the top twenty jazz hits
11662,recommendation_locations,bạn có thể tìm một nhà hàng đẹp trung tâm thành phố ,can you find a nice restaurant downtown
195,datetime_query,mấy giờ rồi ,what is the time
9072,calendar_query,Hiển thị lịch trình của tôi cho ngày hôm nay ,display my schedule for today
5344,weather_query,Có cơ hội tuyết thứ tư ,is there a chance of snow wednesday
15905,email_query,Kiểm tra tất cả các email mới của họ và đánh dấu ngôi sao của họ ,check all the new them emails and mark them star
1809,play_music,Chơi bài hát tôi không nghe thấy gì từ tháng trước ,play the song i didn't hear from last month
6396,general_quirky,Câu hỏi ngu ngốc nhất mà bất cứ ai từng hỏi bạn ,what's the stupidest question anyone ever asked you
9220,play_radio,Chọn trạm bạn muốn ,select station you want
7707,calendar_set,Nhắc nhở tôi rằng tôi có một cuộc họp với Cassy cho một sự kiện OLA xảy ra vào ngày mai ,remind me that i have a meeting with cassy for an ola event happening tomorrow
2148,music_query,Chỉ cho tôi kết quả của những gì tôi đang nghe ,show me results of what i'm listening to
16000,email_query,Alex đã nói với tôi rằng anh ấy sẽ gửi email liên quan đến giá của máy vui lòng kiểm tra xem điều đó có đến không ,alex has told me that he will send an email regarding the price of the machine please check if that has come
10436,lists_createoradd,Tạo một danh sách ,create a list
7354,weather_query,Bạn có thể cho tôi biết thời tiết của Alabama vào ngày mai ,can you let me know the weather of alabama tomorrow
359,datetime_query,Bạn có thể cho tôi biết thời gian ,can you tell me the time
8292,calendar_set,Thêm sự kiện vào lịch và lặp lại ,add event to calendar and repeat
5946,weather_query,Hỏi bạn tôi hows khí hậu ở đó ,ask my friend hows the climate there
9974,cooking_recipe,Trứng thuần chay tốt là gì ,what is a good vegan egg substitute
11540,play_podcasts,Sau khi bắt đầu tập podcast ,following podcast episode start
16958,email_sendemail,Bắt đầu email cho khách hàng ,start email to client
1932,weather_query,là thời tiết bình tĩnh ngày hôm nay ,is the weather calm today
7518,calendar_set,Tiến hành họp vào thứ năm ,conduct meeting on thursday
11847,recommendation_events,Những điều thú vị để làm ngày hôm nay ,fun things to do today
2012,music_query,Tên của bài hát này đang chơi ngay bây giờ là gì ,what is the name of this song playing right now
5543,datetime_query,Xin vui lòng cho tôi biết thời gian hiện tại tại London ,please let me know the current time at london
11387,play_podcasts,Tiếp tục nơi tôi rời khỏi podcast của tôi ,continue where i left off on my podcast
5001,iot_hue_lightup,Làm cho ánh sáng sáng hơn ,make the light more brighter
12417,transport_query,Khi nào là chuyến tàu cuối cùng ngày hôm nay ,when is the last train today
16422,email_query,Email mới nhận được trong giờ qua ,new emails received in past hour
3994,datetime_query,Ngày nào trong tuần là Halloween ,what day of the week is halloween
3158,play_music,Chơi nhạc cổ điển ,play classical music
7306,calendar_set,Tạo một sự kiện mới mỗi thứ Sáu vào buổi trưa ,create a new event every friday at noon
13049,qa_maths,Có bao nhiêu ba có sẵn trong hai mươi bảy ,how many three are available in twenty seven
8854,calendar_remove,Xóa các sự kiện lịch ,remove calendar events
10187,cooking_recipe,Thay thế tốt cho bơ là gì ,what is a good substitute for butter
3170,play_music,Chơi danh sách phát động lực của tôi ,play my motivational playlist
1034,play_music,Chơi nhạc của Justin Bieber ,play the music of justin bieber
8238,calendar_query,Ngày mai là ngày nào ,what date is tomorrow
7362,remove,Chỉ cần xóa sự kiện đính hôn tiếp theo ,just delete the next engagement event
9501,radio,Chơi Howard Stern trên Sirius ,play howard stern on sirius
12443,transport_traffic,Tôi có thể làm về nhà mà không cần kẹt xe ,can i make back home without a traffic jam
425,news_query,Tin tức trái tim là gì ,what are the heartthrob news
8053,calendar_query,Tôi có làm việc vào hai mươi tư ,do i work on the twenty fourth
7935,calendar_set,nhắc nhở tôi vào ngày mà sự kiện này được cho là diễn ra ,remind me the day when this event is supposed to take place
5547,general_quirky,Mong muốn ấm áp cho Mac cho công việc mới ,warm wishes to mac for new job
1291,iot_wemo_off,tắt phích cắm. ,off the plug
12167,transport_traffic,Giao thông ở đường Broadway như thế nào ,how is the traffic in broadway street
2677,datetime_query,ngày nào là hôm nay ,which date is today
1663,datetime_convert,sự khác biệt về thời gian giữa Lagos và New York là những gì ,the time difference between lagos and new york is what
2762,play_music,Chơi nhạc đã chọn ,play selected music
11713,recommendation_events,những gì đang xảy ra ở Milwaukee ,what is going on in milwaukee
10130,cooking_recipe,Ở nhiệt độ nào tôi nên nướng bánh quy ,at what temperature should i bake cookies
3922,datetime_query,Tôi cần biết ngày hôm nay là gì ,i need to know what is the date today
13212,general_quirky,Tôi có thể chảy máu bao nhiêu trước khi chết ,how much can i bleed before i die
838,alarm_remove,Hủy bỏ cuộc gọi trong tuần này ,cancel wake up calls for this week
14471,qa_factoid,Lịch sử của Abraham Lincoln ,history of abraham lincoln
13276,qa_factoid,Giải thích Bob Dylan. ,explain bob dylan
14371,qa_currency,nói với tỷ giá hối đoái của pound ,tell exchange rate of pound
1517,takeaway_order,Đặt một giăm bông và bánh sandwich phô mai từ tàu điện ngầm ,order a ham and cheese sandwich from subway
1114,play_music,Tập hợp tất cả các bài hát của tôi từ Madonna ,gather all my songs from madonna
9785,play_audiobook,mở sách ,open book
1138,takeaway_order,Gọi Eastwind và đặt hàng Lomaine để đi ,call eastwind and order lomaine to go
3558,play_music,Bỏ qua bài hát tiếp theo ,skip to the next song
10012,cooking_recipe,Tìm kiếm bữa ăn yêu thích của bạn ,search for your favorite meal
7576,calendar_set,lặp lại hàng ngày ,repeat daily
11134,lists_remove,Xóa danh sách các cuộc gọi đi ,remove list of outgoing calls
3095,weather_query,Thời tiết ở thành phố Minneapolis là gì ,whats the weather in minneapoliscity
8131,calendar_query,Tôi đã đốt bao nhiêu calo trong khoảng từ ba đến năm ngày hôm nay ,how many calories did i burn between three and five today
6614,general_quirky,bức tranh ,painting
15164,social_post,bạn có thể đăng doanh nghiệp của mình trên facebook không ,can you post my business on facebook
11221,lists_createoradd,Đặt giày trong danh sách của tôi ,put shoes on my list
7411,calendar_set,Thông báo cho tất cả các sinh nhật vào tuần tới ,notify all birthdays next week
335,weather_query,Tôi muốn biết thời tiết ở S.f. ,i wish to know the weather in s.f.
1556,weather_query,xin vui lòng cho tôi báo cáo thời tiết trong tuần này ,please give me the weather report for this week
7834,calendar_query,"Trong ngày dự án, một dự án là do con gái tôi có một bài hát ",on the day project one is due does my daughter have a recital
9034,calendar_query,Cuộc họp lịch tháng 7. ,meeting july calendar
15951,sendemail,Dự thảo phản hồi với email của John ,draft response to john's email
16999,email_query,Có email chưa đọc nào từ danh bạ của tôi không ,is there any unread emails from my contacts
13590,qa_factoid,nhiệt độ ngay bây giờ ở New York là gì ,what is the temperature right now in new york
