ids,intents,sentences,sentence_orgin
13448,qa_factoid,Chuck Norris sinh năm nào ,what year was chuck norris born
8650,calendar_set,Thêm một sự kiện nhắc nhở thông báo và sự kiện lịch cho thứ Năm tại Seven AM có nhãn BÁN HÀNG BÁN HÀNG ,add a notification reminder and calendar event for thursday at seven am labeled sales meeting please
656,weather_query,Thời tiết hiện tại ở Washington DC như thế nào ,how is the current weather in washington dc
8529,weather_query,cho tôi thời tiết cho Merced lúc ba giờ chiều ,give me the weather for merced at three pm
15482,social_post,Kiểm tra tôi về nhà trên facebook ,check me into home on facebook
13921,qa_factoid,một quả cam nặng bao nhiêu ,how much does an orange weigh
11144,lists_createoradd,Thêm bài hát mới vào danh sách phát ,add new songs to playlist
12255,transport_traffic,Còn giao thông thành phố New York thì sao ,what about the new york city traffic
1464,news_query,cho tôi cập nhật về tình hình ở Pháp ,give me updates on the situation in france
15089,qa_currency,Vui lòng tra cứu trao đổi giữa chúng tôi và Mexico ,please look up exchange between us and mexco
14571,qa_factoid,Vợ chồng Angelina Jolie ,angelina jolie spouses
9272,play_music,Bật một số âm nhạc ,turn on some music
7155,calendar_query,Tôi có một cuộc hẹn hai chiều không ,do i have a two pm appointment
4734,alarm_set,Đặt báo thức cho chín giờ sáng vào cuối tuần ,set the alarm for nine am on weekends
10722,lists_createoradd,hey olly tôi cần bạn lập một danh sách các cầu thủ cricket của đội Ấn Độ chơi cho đội quốc tế trong hai nghìn và mười bốn ,hey olly i need you to make a list of cricket players of indian team who played for the international team in two thousand and fourteen
5927,news_query,cung cấp cho tôi tin tức về iphone ,provide me with the news about iphone
1105,weather_query,Đưa tôi dự báo thời tiết của Bắc Kinh ,get me the weather forecast of beijing
16328,email_query,Tôi đã trả lại bất kỳ email mới nào kể từ khi tôi rời đi ,i'm back any new emails since i left
10069,cooking_recipe,Có bao nhiêu muỗng cà phê trong một cốc ,how many teaspoons are in a cup
13234,qa_maths,mười ba cộng mười bốn ,what's thirteen plus fourteen
1792,general_greet,"Chào buổi chiều, bạn khỏe không ",good afternoon how are you
5676,datetime_query,Hai mươi hai có thể là ngày sinh của tôi và tôi muốn biết ngày nào là hai mươi ba tháng 5 ,may twenty two is my birthdate and i want to know the what day is twenty third may
3952,takeaway_query,một khu vườn ô liu ở đâu ,where is an olive garden that does takeaway
6316,weather_query,Thơi tiêt thê nao ,how's the weather
8440,calendar_remove,Xóa tất cả các sự kiện khỏi lịch của tôi ,delete all the events from my calendar
5599,takeaway_query,Điều gì là thời gian chính xác chúng ta nhận thức ăn được giao sau khi chúng tôi đặt hàng cho thực phẩm ,what's the exact time we get food delivered once we place an order for food
4384,weather_query,thời tiết sẽ nóng hoặc lạnh vào ngày mai ,will the weather be hot or cold tomorrow
16441,email_sendemail,Gửi email đến Carl rằng tôi sẽ đến muộn để làm việc vào ngày mai ,send email to carl that i will be late for work tomorrow
16920,email_query,Kiểm tra thư với chủ đề ,check mail with subject
16257,email_sendemail,Gửi email cho vợ tôi về thời tiết tuần tới ,send an email to my wife about next week weather
5076,play_music,Chơi một số nhạc jazz mềm ,play some soft jazz
4325,play_music,Chơi Tôi là một người sống sót bởi con của Destiny ,play i am a survivor by destiny's child
5922,audio_volume_up,Vui lòng nâng cao khối lượng loa ,please raise the volume of speaker
15961,email_sendemail,Tôi cần gửi email đến Laura ,i need to send an email to laura
10768,lists_query,là cuốn sách Stephen King mới trong danh sách của tôi ,is the new stephen king book on my list
5166,weather_query,nó sẽ mưa sau đó ở Manila ,will it rain later in manila
7550,calendar_set,quản lý một cuộc họp cho buổi sáng hôm nay ,manage a meeting for today morning
8647,calendar_query,Tôi đang nhắc nhở những lời nhắc gì ,what reminders do i have pending
10644,lists_remove,Xóa phô mai khỏi danh sách của tôi ,remove cheese from my list
1686,weather_query,Có phải là có hoặc không có nhiệt độ ngày mai nào sẽ nóng ,is it a yes or a no that tomorrows temperature will be hot
14788,qa_currency,một đô la có giá trị bao nhiêu so với yên ,how much is a dollar worth compared to a yen
3832,play_music,bật một số nhạc rap ,turn on some rap music
10541,lists_query,Tôi có thể biết những gì tôi trong danh sách ,can i know what i on the list
10233,cooking_recipe,là cá và khoai tây chiên thực sự là người Anh ,is fish and chips really british
4262,play_music,Chơi lặp lại xin vui lòng ,play repeats please
1919,query,Nói cho tôi biết về thời tiết trong tuần này ,tell me about the weather this week
4525,weather_query,Dự báo thời tiết cho ngày hôm nay là gì ,what is the weather forecast for today
13912,qa_factoid,Madonna bao nhiêu tuổi ,how old is madonna
15964,email_query,Có ai gửi email cho tôi hôm nay không ,did anybody email me today
6250,general_quirky,Mục nhật ký cho ngày hôm nay ,journal entry for today
14319,qa_factoid,Người phối ngẫu của Obama như thế nào ,how is the spouse of obama
8128,music_query,cho tôi các chi tiết về elton john ,give me the details on elton john
16383,email_query,hey olly tôi có bất kỳ email mới nào ,hey olly do i have any new emails
2988,takeaway_query,Tôi có thể nhận được giao hàng từ Dominos không ,can i get delivery from dominos
12761,transport_traffic,Có phải là bội thu để cản ,is it bumper to bumper
5818,weather_query,Thời tiết ở quê nhà là gì ,what is the weather in home town
4432,play_music,Chơi danh sách phát tập luyện của tôi trong Spotify ,play my workout playlist in spotify
8809,calendar_set,Thiết lập một cuộc họp với Peter Francis vào thứ Hai lúc hai giờ chiều ,set up a meeting with peter francis for monday at two pm
11412,play_podcasts,Bắt đầu podcast chơi gần đây nhất của tôi ,start my most recently played podcast
11492,play_podcasts,Chơi danh sách yêu thích quốc gia của tôi cho tôi ,play my country favorites playlist for me
1903,news_query,tóm tắt tôi về trận đấu bóng đá ngày nay ,brief me about today's football match
8779,calendar_set,Nhắc nhở tôi kiểm tra lò trong mười lăm phút ,remind me to check the oven in fifteen minutes
16068,email_querycontact,Địa chỉ hiển thị của John ,display address of john
9750,play_audiobook,Sử dụng nút Play PAUSE ,using play pause button
284,weather_query,nó sẽ mưa vào buổi tối ,is it going to rain in the evening
16667,email_addcontact,Thêm Dan @ Dancom vào danh bạ của tôi ,add dan@dancom to my contacts
3650,weather_query,Chỉ cho tôi thời tiết cho Dallas ,show me the weather for dallas
1004,alarm_remove,Hãy tắt báo thức của tôi cho buổi tối này ,please turn off my alarm for this evening
4209,weather_query,Tôi có nên lấy một chiếc ô với tôi tối nay ,should i take an umbrella with me tonight
15419,social_post,hey đăng khiếu nại của tôi đến Microsoft trên Twitter ,hey post my complaint to at microsoft on twitter
11908,recommendation_events,Olly những gì một số sự kiện sắp tới tôi có thể muốn đi đến ,olly what's some upcoming events i might want to go to
4641,news_query,Những gì trong tin tức ngày hôm nay ,what's in the news today
11766,recommendation_movies,nhận thức an ninh ,security awareness
14376,qa_factoid,Michael Jackson đã chết như thế nào ,how did michael jackson die
3765,alarm_set,Vui lòng đặt báo thức cho tôi ,please set an alarm for me
2020,audio_volume_up,Tăng khối lượng theo hai cấp độ ,increase volume by two levels
3430,iot_cleaning,bạn có thể vui lòng đặt chân không vào ,can you please put the vacuum on
13735,qa_stock,là dow lên hoặc xuống ,is the dow up or down
12560,transport_taxi,Tôi cần một chiếc taxi uber ,i need a taxi uber
794,alarm_query,Xác nhận báo động cho sáng mai ,confirm alarm for tomorrow morning
3932,iot_coffee,ướp một nồi cà phê ,brew a pot of coffee
9360,play_radio,Nhận đài ,get radio
12311,transport_traffic,Có bất kỳ hạn chế giao thông nào do chuyến thăm của Tổng thống ,are there any traffic restrictions due to the president's visit
14403,qa_stock,Giá cổ phiếu của SENSEX là bao nhiêu ,what is the stock price of sensex right now
10873,lists_remove,Xóa danh sách mua sắm ,delete shopping list
4543,takeaway_order,đặt hàng một chiếc bánh pizza vừa với pepperoni và thịt xông khói trên đó ,order a medium pizza with pepperoni and bacon on it
14935,general_quirky,Khi nào là thời điểm tốt nhất để mua sắm tại mục tiêu để tôi không phải đối phó với rất nhiều người ,when is the best time to shop at target so that i don't have to deal with a lot of people
3777,iot_hue_lightchange,Tôi muốn đèn màu cam bây giờ ,i would like orange lights now
10416,play_game,chúng ta sẽ chơi một trò chơi ,shall we play a game
10914,lists_query,Xin vui lòng cho tôi biết những danh sách tôi có ,please tell me what lists i have
7961,calendar_remove,Xóa tất cả các cuộc họp của tôi ,delete all my meetings
11187,lists_query,Danh sách đảng của tôi ,my party list
8796,calendar_query,Hiển thị nhắc nhở ngày mai ,show todays reminders
8490,calendar_query,Xin vui lòng cho tôi biết những điểm chính của hai trăm cuộc họp từ chiều nay ,please tell me the main points of my two hundred meeting from this afternoon
14832,qa_factoid,giá trị ròng của người nổi tiếng là gì ,what is the net worth of the celebrity
4716,alarm_set,xin vui lòng chúng tôi là báo động sau đây ,please we're the following alarm
4456,news_query,Kiểm tra tin tức mới nhất ,check latest news
9843,play_audiobook,Vui lòng tiếp tục bài hát hiện tại của MASTI ,please resume current song of masti
1052,weather_query,Ngày nay cơ hội mưa là gì ,what is the chance of rain today
7983,calendar_remove,Xóa tất cả các sự kiện và nhiệm vụ cho ngày hôm nay ,delete all events and tasks for today
16608,email_query,Kiểm tra xem tôi có email nào không ,check out if i got any email
856,play_music,âm nhạc r và b ,r and b music
4650,music_dislikeness,Tôi không muốn nghe thêm bất kỳ bài hát nào về loại đó ,i don't want to hear any more songs of that type
11599,recommendation_events,Bạn có thể cho tôi biết tôi có thể đi những loại chương trình nào trong đêm nay ở Miami ,can you tell me what kind of show can i go tonight in miami
5194,datetime_query,Tôi cần biết thời gian nào đang ở thành phố New York ,i need to know what time it is right now in new york city
9781,play_audiobook,đưa vào thần nhỏ ,put on the god of small things
17022,email_sendemail,Alexa email mẹ và hỏi thời tiết ở đó như thế nào ,alexa email mom and ask how the weather is there
11170,lists_query,cung cấp danh sách ,provide the list
16994,email_query,Là thư từ Chris về công việc ,is the mail from chris about work
12106,recommendation_locations,Tôi cần biết nơi để có được cánh gà trong benton ar ,i need to know where to get chicken wings in benton ar
14334,qa_stock,Làm thế nào cao là s n. P ,how high is the s n. p
9046,calendar_remove,Trong tuần của Twentieth xóa tất cả các sự kiện dạy kèm ,for the week of the twentieth delete all tutoring events
4206,play_music,Chơi rõ ràng bởi Zedd ,play clarity by zedd
12017,recommendation_locations,Xác định vị trí cửa hàng Pizza địa phương ,locate local pizza shops
8168,calendar_set,Nhắc nhở tôi về cuộc gặp gỡ của tôi với bà Boland vào thứ Tư tám trăm giờ sáng thứ ba bảy giờ chiều ,remind me of my meeting with ms boland on wednesday eight hundred am on tuesday seven pm
3660,alarm_set,Đặt báo thức cho bảy giờ sáng ,set an alarm for seven am
15623,social_post,tweet khiếu nại để chăm sóc khách hàng ,tweet complaint to customer care
8956,calendar_set,Tôi muốn năm giờ giải phóng cho sinh nhật của Jenn vào thứ bảy này ,i want five hours freed up for jenn's birthday this saturday
9206,play_radio,Bật radio ,turn on the radio
14616,qa_factoid,Sandra bullock có bao nhiêu đứa trẻ ,how many children does sandra bullock have
12431,transport_query,Khi tàu ga New York sẽ đến ,when new york train will arrive
13269,qa_factoid,Hughman bao nhiêu tuổi ,how old is hugh jackman
15568,social_post,Soạn Tweet cho YouTube ,compose a tweet for youtube
3729,play_music,Tôi muốn nghe tôi hiểu bạn Babe bởi Sonny và Cher bạn có thể chơi điều đó ,i want to hear i got you babe by sonny and cher can you play that
5789,weather_query,hôm nay trời nắng ,its sunny today
2523,news_query,những gì đang xảy ra xung quanh đây ,whats going on around here
1113,music_likeness,Lưu tất cả các bài hát từ Katy Perry ,save all songs from katy perry
8830,calendar_remove,Xóa tất cả dữ liệu từ Lịch ,erase all data from calendar
3267,music_likeness,"Vui lòng lưu đánh giá của tôi về bài hát này, đó là năm sao xin vui lòng ",please save my rating on this song it is five stars please
4724,alarm_query,Báo động của tôi là gì ,what are my alarms
1471,audio_volume_up,nâng âm lượng lên sáu mươi ,raise the volume to sixty
16485,email_query,Tôi có tin nhắn trong hộp thư đến của mình không ,do i have messages in my inbox please
16537,email_sendemail,Bây giờ tôi cần viết một email cho đồng nghiệp của tôi ,now i need to write an email to my colleague
13880,qa_factoid,Google Michael Jackson. ,google michael jackson
11218,lists_query,Làm mới danh sách của tôi và cho tôi biết những gì trên đó ,refresh my list and tell me whats on it
10098,cooking_recipe,bạn có thể chuẩn bị một bánh sandwich phô mai ,can you prepare a cheese sandwich
16870,email_querycontact,Làm thế nào để tiếp cận hành lang ,how to reach hallway
15198,social_post,Đăng trong Pinterest về công thức gà mới của tôi ,post in pinterest about my new chicken recipe
7041,calendar_set,Tôi cần lịch một cuộc họp với Nathan vào thứ Hai lúc chín giờ sáng ,i need to calendar a meeting with nathan on monday at nine am
14529,qa_currency,tỷ lệ euro cho bạn là bao nhiêu. S. d. ,what is rate of euro to u. s. d.
13379,general_quirky,cho tôi biết làm thế nào để kéo dài trước khi chạy ,tell me how to stretch before running
14670,qa_definition,Định nghĩa XY. ,definition xy
9167,calendar_set,Thông báo cho tôi hai giờ trước cuộc họp của tôi ,notify me two hours before my meeting
13729,qa_factoid,Nói cho tôi biết về Sean Connery ,tell me about sean connery
1972,iot_hue_lightoff,Tắt đèn chính ,switch off main light
4774,general_joke,Tôi muốn nghe một trò đùa ,i want to listen to a joke
16807,email_addcontact,Thêm apahelp @ yahoo dot com vào danh bạ của tôi ,add apahelp@yahoo dot com to my contacts
4617,takeaway_order,Liên hệ với Pizza Hut và đặt hàng một chiếc bánh pizza lớn với giăm bông và nấm ,contact pizza hut and order a large pizza with ham and mushrooms
8955,calendar_set,Thứ năm lúc ba giờ tối có một cuộc họp giáo viên tôi cần được nhắc nhở về ,thursday at three pm there is a teachers meeting i need to be reminded of
3191,play_music,Chơi danh sách phát Chúng tôi đã lắng nghe đêm qua ,play the playlist we were listening last night
16071,email_querycontact,Hiển thị số và email liên lạc của Rehan ,show number and contact email of rehan
1505,iot_wemo_on,Bật phích cắm WEMO ,turn on the wemo plug
6563,general_quirky,chính tả ,spelling
15740,social_post,làm một bài viết ,make a post
2637,news_query,mở tin tức ,open news
7387,calendar_query,Tôi có bao nhiêu lời nhắc nhở đang chờ xử lý ,how many pending reminders do i have
2852,audio_volume_mute,câm trong hai giờ ,mute for two hours
1398,play_music,Chơi nhạc Taylor Swift ,play taylor swift music
10739,lists_createoradd,Tôi muốn biết một mục bổ sung có thể được thêm vào danh sách tạp hóa của tôi ,i want to know could an extra item be added to my grocery list
14736,cooking_query,Cách dễ nhất và nhanh nhất để nấu một con gà tây ,what's the easiest and quickest way to cook a turkey
1526,music_likeness,Thêm bài hát đó vào danh sách phát của tôi ,add that song to my playlist
15870,email_querycontact,id email của john là gì ,what is email id of john
7069,calendar_query,lên lịch một cuộc họp bằng cách hỏi bạn ,schedule a meeting by asking your
6429,general_quirky,Tìm cho tôi bản sao rẻ nhất của cơ thể bốn giờ ,find me the cheapest copy of the four hour body
9322,play_radio,Làm cho đài của tôi bật ,make my radio turn on
11651,recommendation_locations,Hãy xem những gì xung quanh ,let's see whats around
8265,calendar_set,nhắc nhở tôi về cuộc họp ngày mai tối nay ,remind me about tomorrow's meeting tonight
16033,email_sendemail,Gửi thư đến Alex hỏi về thanh toán do ,send a mail to alex asking about the due payment
10205,cooking_recipe,lấy cho tôi công thức cho gạo ,get me the recipe for rice
5200,music_likeness,Lưu bài hát này trong danh mục Bài hát tuyệt vời của tôi ,save this song in my great songs category
10778,lists_query,Tôi có một danh sách để làm cho ngày hôm nay không tôi ,i do have a to do list for today don't i
5320,weather_query,Chỉ cho tôi thời tiết hôm nay ,show me yesterdays weather
13350,qa_maths,Hai lần hai là gì ,what is two times two
15573,social_post,Tweet một khiếu nại đến đô thị địa phương ,tweet a complaint to local municipality
1195,play_music,Tôi rất thích nghe bất kỳ bài hát nào mà tôi đã cung cấp năm sao bởi Serge Gainsbourg ,i'd love to hear any song that i've given five stars by serge gainsbourg
5583,play_music,Trợ lý xin vui lòng chơi Royksopp chạy ra biển ,assistant please play royksopp running to the sea
4949,music_likeness,Lưu bài hát này trong mục yêu thích của tôi ,save this song in my favorites
6005,weather_query,Hôm nay có gió không gió ,is it going to be windy today
16963,email_sendemail,Đọc email và gửi đến thành viên gia đình ,read email and send to family member
11723,recommendation_movies,Thông báo cho tôi về bộ phim ROM Com nổi tiếng nhất đang chơi hiện tại trong rạp chiếu phim trên New York ,inform me about the most popular rom com movie playing now in theatres across new york
6606,recommendation_movies,mười bộ phim hàng đầu ,top ten movies
2043,iot_hue_lightoff,tôi không cần ánh sáng ,i dont need light
130,takeaway_order,đặt bánh pizza ,order a pizza
9776,play_audiobook,Bắt đầu cuốn sách âm thanh của tôi từ nơi tôi rời đi ,start my audio book from where i left off
9581,play_radio,Chơi cho tôi chương trình American Idol ,play for me the programme american idol
8135,calendar_set,Nhắc nhở tôi về cuộc họp ba giờ chiều của tôi vào ngày mai bốn giờ trước ,remind me of my three pm meeting tomorrow four hours in advance
15317,social_post,Hôm nay là chồng của chồng tôi sinh nhật ,today is my husbands birthday
11351,play_podcasts,Chỉ cần cho tôi biết thời gian tàu đến California ,just let me know the train time to california
15292,social_post,Đăng một tin nhắn cho Facebook ,post a message to facebook
11710,recommendation_locations,Cửa hàng tốt nhất trong khu vực địa phương ,best shop in local area
13981,qa_currency,u. S. d. Vị trí bây giờ ,u. s. d. position now
12926,transport_query,Dolly Mất bao lâu để tàu đến Orlando ,olly how long does it take for the train to get to orlando
930,music_settings,Lặp lại bài hát này ,repeat this song
8048,calendar_set,vào sinh nhật chị em của tôi gửi hoa của cô ấy ,on my sisters birthday send her flowers
3526,play_music,Thời gian để tập luyện ,time to workout
15571,social_post,tweet khiếu nại đến domino ,tweet complaint to dominoes
11051,lists_query,những gì trong danh sách của tôi ,whats on my list
11456,podcasts,Bỏ qua ,skip forward
12635,transport_ticket,Tìm một chuyến tàu không ngừng đến Seattle ,find a non stop train to seattle
15743,social_post,Viết một tweet cho công ty này ,write a tweet to this company
8845,calendar_remove,Làm cho lịch của tôi trống ,make my calendar empty
12734,transport_query,xin vui lòng cho tôi hướng dẫn đến một công viên gần tôi ,please give me directions to a park near me
16725,email_query,Tìm tất cả các email có chứa chủ đề sau ,find all emails that contain the following subject
16134,email_sendemail,Gửi email đến cha tôi sẽ đến bữa tiệc sinh nhật ,send email to daddy i'll be going to the birthday party
12475,transport_query,Làm thế nào xa là dừng nghỉ ngơi gần nhất ,how far away is the nearest rest stop
14905,qa_currency,là pound lên hoặc xuống so với đồng đô la ,is the pound up or down against the dollar
8798,calendar_query,Xin vui lòng cho tôi biết khi nào là bữa tiệc sinh nhật của Jenny ,please tell me when is the birthday party of jenny
11398,play_podcasts,Chơi tập tiếp theo của podcast này ,play the next episode of this podcast
8169,calendar_set,xin vui lòng nhắc nhở tôi về việc đi tập thể dục vào mỗi sáng thứ Hai vào tối chủ nhật ,please remind me of going to gym every monday morning on sunday night
4070,audio_volume_up,Làm ơn tăng khối lượng ,increase the volume please
11252,lists_createoradd,Vui lòng thêm mục vào danh sách ,please add item to list
13668,qa_factoid,Làm thế nào đồi núi ở Sacramento ,how hilly is it in sacramento
982,iot_hue_lightchange,Thay đổi màu sắc của đèn trong nhà tôi từ trắng đến vàng ,change the color of the lights in my house from white to yellow
12273,transport_query,Đặt hướng đến thị trường trung tâm ,set direction to central market
1746,music_likeness,tôi yêu bài hát làm bạn ,i love the song do you
1275,iot_coffee,Hãy làm cho tôi cà phê tốt đẹp ,please make me nice coffee
3621,news_query,Tìm cho tôi những tin tức hàng đầu trong ngày ,find me the top news of the day
15278,calendar_query,Thông báo của tôi là gì ,what are my notifications
6820,calendar_set,Có một ban nhạc tốt chơi tối nay lúc chín giờ tại Jazz Bar tôi muốn đi ,there's a good band playing tonight at nine at jazz bar i want to go
1857,audio_volume_down,xuống ,down
5483,datetime_query,Ngày thứ bảy tuần sau là gì ,what is the date next saturday
7706,calendar_set,Tôi có một cuộc họp vào sáng mai lúc mười xin vui lòng nhắc nhở tôi ,i have a meeting tomorrow morning at ten please remind me
8407,calendar_query,Những sự kiện nào tôi có cho tuần tới ,what events do i have for this coming week
10726,lists_query,Chỉ cho tôi danh sách của tôi ,show me my lists
5522,general_joke,làm tôi buồn cười ,humor me
6960,calendar_set,nhắc nhở tôi về cuộc họp của tôi vào hai giờ chiều ,remind me about my meeting at two pm
13956,qa_definition,chuối là gì ,what is a banana
5769,takeaway_query,Có một takeaway trong nhà hàng chipotle ,is there a takeaway in chipotle restaurant
6636,qa_stock,tỷ giá hối đoái ,stock exchange rates
8698,calendar_set,đặt tôi vào thứ ba hai mươi đầu tiên ở mười với al ,put me in on tuesday the twenty first at ten with al
13654,qa_factoid,ngọn núi cao nhất thế giới là gì ,what is the highest mountain in the world
11150,lists_remove,Xóa danh sách xin vui lòng ,remove list please
3810,audio_volume_up,Tăng âm lượng của loa ,increase the volume of the speaker
1236,iot_hue_lightchange,bạn có thể vui lòng thay đổi tâm trạng của ánh sáng ,can you please change the mood of the light
13444,qa_factoid,Madonna sinh ra khi nào ,when was madonna born
2953,play_music,Chơi nhạc mà tôi thích ,play music that i like
7881,calendar_query,Sự kiện nào là tiếp theo ,what event is next
9102,calendar_query,Tôi có bất cứ điều gì theo lịch trình cho một PM vào thứ Hai tuần sau ,do i have anything scheduled for one pm next monday
4765,weather_query,nó sẽ mưa vào thứ sáu ,is it going to rain on friday
2349,iot_hue_lightchange,Thay thế các màu sáng hiện tại trong nhà với những màu tối ,replace the current light colours in the house with dark ones
